  <!ELEMENT grammar - - (syntax+, keyword*, punctuation*)>
  <!ATTLIST grammar
    name        CDATA                               #IMPLIED
  >
  
  <!ELEMENT syntax - O (content)*>
  <!ATTLIST syntax
    id          ID                                  #REQUIRED
    abstract    (abstract|concrete)                 concrete
    multiple    (yes|no)                            no
  >

  <!ELEMENT content - O EMPTY>
  <!ATTLIST content
    type        (syntax|keyword|punctuation|
                  colon|semicolon|identifier|
                  attribute|literal|eof)            syntax
    link        IDREF                               #IMPLIED
    property    CDATA                               #IMPLIED
    multiple    (yes|no)                            no
    optional    (yes|no)                            no
  >

  <!ELEMENT keyword - O EMPTY>
  <!ATTLIST keyword
    id          ID                                  #REQUIRED
  >

  <!ELEMENT punctuation - O EMPTY>
  <!ATTLIST punctuation
    id          ID                                  #REQUIRED
    value       CDATA                               #REQUIRED
  >
